disease,symptoms
uterine atony,"sharp abdominal pain, lower abdominal pain, blood in urine, intermenstrual bleeding, pain during pregnancy, problems during pregnancy, spotting or bleeding during pregnancy, uterine contractions, back cramps or spasms"
trichinosis,"nasal congestion, knee lump or mass"
whooping cough,"shortness of breath, sore throat, cough, nasal congestion, vomiting"
open wound of the lip,"lip swelling, dry lips, facial pain, mouth ulcer, mouth pain"
subacute thyroiditis,"palpitations, blood in stool, pain during pregnancy, problems during pregnancy, uterine contractions"
oral mucosal lesion,"sore throat, cough, lip swelling, toothache, facial pain, mouth ulcer, fever, tongue lesions, gum pain, mouth pain"
open wound due to trauma,"wrist swelling, skin on arm or hand looks infected"
intracerebral hemorrhage,"depressive or psychotic symptoms, dizziness, vomiting, headache, nausea, diminished vision, weakness, blindness, focal weakness, seizures"
alzheimer disease,"depression, depressive or psychotic symptoms, difficulty speaking, hostile behavior, irregular appearing scalp, eye burns or stings, disturbance of memory, delusions or hallucinations"
vaginismus,"suprapubic pain, sharp abdominal pain, pain during intercourse, lower abdominal pain, pelvic pain, vaginal pain"
systemic lupus erythematosis (sle),"sharp chest pain, hand or finger stiffness or tightness, knee pain, bones are painful, leg swelling, ache all over"
premature ovarian failure,"lack of growth, pelvic pain, weight gain, absence of menstruation, infertility"
thoracic outlet syndrome,"sharp chest pain, hand or finger pain, arm pain, decreased appetite, loss of sensation, shoulder pain"
ganglion cyst,"leg pain, hand or finger pain, wrist swelling, skin growth, knee pain, foot or toe pain, knee swelling, knee lump or mass, hand or finger lump or mass, wrist lump or mass"
dislocation of the knee,"knee pain, knee swelling, knee stiffness or tightness"
crohn disease,"blood in stool, sharp abdominal pain, vomiting, nausea, diarrhea, pain of the anus, regurgitation, burning abdominal pain, regurgitation.1, rectal bleeding"
postoperative infection,"skin swelling, sharp abdominal pain, abnormal appearing skin, jaw swelling, fever, skin on leg or foot looks infected"
folate deficiency,"shortness of breath, sharp chest pain, sharp abdominal pain, vomiting blood, difficulty breathing"
fluid overload,"shortness of breath, sharp chest pain, sharp abdominal pain, vomiting, nausea, hand or finger swelling, peripheral edema, fluid retention"
atrial flutter,"shortness of breath, sharp chest pain, chest tightness, palpitations, irregular heartbeat, frequent urination, swollen lymph nodes, increased heart rate"
skin disorder,"skin swelling, abnormal appearing skin, skin lesion, acne or pimples, skin growth, irregular appearing scalp, skin moles, itching of skin, skin dryness, peeling, scaliness, or roughness, skin irritation"
floaters,"diminished vision, symptoms of eye, foreign body sensation in eye, spots or clouds in vision, lacrimation"
tooth disorder,"headache, toothache, facial pain, mouth ulcer, peripheral edema, ear pain, jaw swelling, gum pain, bleeding gums, pain in gums"
heart attack,"shortness of breath, sharp chest pain, chest tightness, irregular heartbeat, fainting, nausea, arm pain, heartburn, increased heart rate, burning chest pain, sweating"
open wound of the abdomen,"sharp abdominal pain, blindness, irregular belly button"
fracture of the leg,"leg pain, hip pain, knee pain, ankle pain, knee weakness, knee swelling, problems with movement, leg swelling, leg stiffness or tightness, ankle swelling"
oral thrush (yeast infection),"sore throat, cough, nasal congestion, irritable infant, mouth ulcer, fever, tongue lesions, constipation, skin rash, mouth pain"
pityriasis rosea,"skin swelling, vaginal itching, abnormal appearing skin, itching of skin, warts, skin rash"
allergy to animals,"sore throat, cough, nasal congestion, cross-eyed, allergic reaction"
orthostatic hypotension,"sharp chest pain, dizziness, abnormal involuntary movements, irregular heartbeat, fainting, feeling ill, headache, weakness"
obstructive sleep apnea (osa),"shortness of breath, insomnia, abnormal involuntary movements, difficulty in swallowing, mouth dryness, weight gain, difficulty breathing, fatigue, sleepiness, apnea, abnormal breathing sounds, sweating"
hypokalemia,"shortness of breath, sharp chest pain, fainting, sharp abdominal pain, vomiting, headache, nausea, diarrhea, loss of sensation, fever"
psoriasis,"skin swelling, abnormal appearing skin, skin lesion, skin growth, irregular appearing scalp, skin moles, joint pain, itching of skin, skin dryness, peeling, scaliness, or roughness, itchy scalp, skin rash"
dislocation of the shoulder,"wrist pain, arm pain, arm stiffness or tightness, arm swelling, neck mass, shoulder pain"
intussusception,"blood in stool, emotional symptoms, sharp abdominal pain"
cervicitis,"suprapubic pain, sharp abdominal pain, nausea, vaginal itching, painful urination, vaginal discharge, pain during pregnancy, pelvic pain"
abscess of the pharynx,"sharp chest pain, sore throat, cough, nasal congestion, throat swelling, difficulty in swallowing, headache, fever"
primary thrombocythemia,"dizziness, flatulence, fatigue"
arthritis of the hip,"leg pain, hip pain, back pain, low back pain, pelvic pain, knee pain, problems with movement, ache all over, lower body pain, joint pain, groin pain, hip stiffness or tightness"
decubitus ulcer,"difficulty speaking, skin lesion, skin on leg or foot looks infected, incontinence of stool"
hypernatremia,"shortness of breath, fainting, weakness, fever, difficulty breathing"
sensorineural hearing loss,"dizziness, hoarse voice, nasal congestion, diminished hearing, throat feels tight, ear pain, ringing in ear, plugged feeling in ear, itchy ear(s), fluid in ear"
chronic ulcer,"skin lesion, skin pain"
osteoporosis,"hip pain, back pain, bones are painful, disturbance of memory, leg cramps or spasms, stomach bloating, joint pain, muscle cramps, contractures, or spasms, early or late onset of menopause"
ileus,"sharp abdominal pain, vomiting, headache, nausea, diarrhea, lower abdominal pain, pain of the anus, burning abdominal pain, constipation"
sickle cell crisis,"sharp chest pain, leg pain, hip pain, sharp abdominal pain, vomiting, arm pain, back pain, low back pain, burning abdominal pain, knee pain, ache all over"
urethritis,"retention of urine, suprapubic pain, sharp abdominal pain, vaginal itching, painful urination, frequent urination, blood in urine, penis pain, penile discharge"
prostatitis,"retention of urine, sharp abdominal pain, painful urination, frequent urination, lower abdominal pain, blood in urine, back pain, impotence, fever, chills"
otitis externa (swimmer's ear),"sore throat, cough, diminished hearing, facial pain, ear pain, ringing in ear, plugged feeling in ear, itchy ear(s), fluid in ear, fever, redness in ear"
poisoning due to anticonvulsants,"depression, dizziness, difficulty speaking, problems with movement"
testicular torsion,"emotional symptoms, symptoms of the scrotum and testes, swelling of scrotum, pain in testicles, sharp abdominal pain, back pain"
tricuspid valve disease,"anxiety and nervousness, emotional symptoms"
urethral stricture,"retention of urine, suprapubic pain, symptoms of the scrotum and testes, painful urination, involuntary urination, blood in urine, symptoms of prostate, symptoms of bladder"
vitamin d deficiency,"hot flashes, arm stiffness or tightness, fatigue"
hydatidiform mole,"dizziness, sharp abdominal pain, diminished vision, pain during pregnancy, spotting or bleeding during pregnancy"
pain disorder affecting the neck,"dizziness, insomnia, headache, arm pain, back pain, neck pain, low back pain, neck stiffness or tightness, disturbance of memory"
tuberculosis,"shortness of breath, cough, vaginal itching, congestion in chest"
pelvic fistula,"dizziness, elbow weakness, vaginal discharge"
acute bronchiolitis,"shortness of breath, cough, nasal congestion, irritable infant, vomiting, wheezing, decreased appetite, fever, difficulty breathing, coryza, pulling at ears, hurts to breath"
presbyopia,"difficulty speaking, diminished vision, symptoms of eye, pain in eye, abnormal movement of eyelid, foreign body sensation in eye, spots or clouds in vision"
dementia,"depressive or psychotic symptoms, insomnia, abnormal involuntary movements, hostile behavior, problems with movement, focal weakness, disturbance of memory, delusions or hallucinations"
insect bite,"skin swelling, hand or finger swelling, lip swelling, abnormal appearing skin, skin lesion, peripheral edema, leg swelling, fluid retention, itching of skin, skin rash"
paroxysmal ventricular tachycardia,"shortness of breath, sharp chest pain, dizziness, chest tightness, irregular heartbeat, fainting, weight gain, decreased heart rate, increased heart rate, fatigue"
congenital heart defect,"sharp chest pain, lack of growth, arm swelling, hand or finger stiffness or tightness"
connective tissue disorder,"difficulty in swallowing, feeling ill, joint pain"
foreign body in the eye,"white discharge from eye, symptoms of eye, pain in eye, foreign body sensation in eye, eye redness, lacrimation, itchiness of eye, eye burns or stings"
poisoning due to gas,"shortness of breath, sharp chest pain, dizziness, cough, headache, wheezing, drainage in throat"
pyogenic skin infection,"skin swelling, leg pain, hand or finger pain, hand or finger swelling, abnormal appearing skin, skin lesion, peripheral edema, foot or toe pain, leg swelling, foot or toe swelling, skin rash"
endometrial hyperplasia,"back weakness, involuntary urination, heavy menstrual flow, unpredictable menstruation, vaginal bleeding after menopause"
acanthosis nigricans,"skin lesion, acne or pimples, skin growth, weight gain"
central atherosclerosis,"shortness of breath, irregular heartbeat, blood in urine, fatigue"
viral exanthem,"cough, nasal congestion, skin swelling, vomiting, abnormal appearing skin, decreased appetite, fever, pulling at ears, itching of skin, skin rash"
noninfectious gastroenteritis,"blood in stool, sharp abdominal pain, vomiting, headache, nausea, diarrhea, burning abdominal pain, decreased appetite, fever, chills, rectal bleeding, fluid retention"
benign prostatic hyperplasia (bph),"retention of urine, swelling of scrotum, pain in testicles, involuntary urination, frequent urination, blood in urine, impotence, symptoms of prostate, excessive urination at night, symptoms of bladder, hesitancy, low urine output"
menopause,"vaginal itching, involuntary urination, hot flashes, absence of menstruation, unpredictable menstruation, sweating"
primary immunodeficiency,"cough, arm stiffness or tightness, frontal headache, decreased appetite, fatigue"
ovarian cancer,"groin mass, sharp abdominal pain, decreased appetite, stomach bloating"
cataract,"diminished vision, double vision, symptoms of eye, pain in eye, abnormal movement of eyelid, spots or clouds in vision, lacrimation, itchiness of eye, blindness, cloudy eye"
dislocation of the hip,"leg pain, hip pain, abusing alcohol"
spinal stenosis,"leg pain, hip pain, headache, arm pain, back pain, neck pain, low back pain, problems with movement, loss of sensation, paresthesia, shoulder pain, lower body pain"
intestinal obstruction,"retention of urine, sharp abdominal pain, vomiting, nausea, vaginal itching, pain of the anus, burning abdominal pain, stomach bloating, constipation"
heart contusion,"depression, elbow weakness"
congenital malformation syndrome,"diminished hearing, lack of growth, seizures, gum pain"
sporotrichosis,"wrist pain, knee pain"
lymphangitis,"arm pain, neck swelling"
wernicke korsakoff syndrome,"anxiety and nervousness, depressive or psychotic symptoms, abusing alcohol"
intestinal disease,"sharp chest pain, fainting, sharp abdominal pain, vomiting, nausea, diarrhea, regurgitation, burning abdominal pain, regurgitation.1"
acute bronchitis,"shortness of breath, sharp chest pain, sore throat, cough, nasal congestion, headache, wheezing, fever, difficulty breathing, coughing up sputum, coryza, congestion in chest"
persistent vomiting of unknown cause,"dizziness, abnormal involuntary movements, sharp abdominal pain, vomiting, nausea, diarrhea, fever"
open wound of the foot,"skin lesion, foot or toe pain, foot or toe swelling, skin on leg or foot looks infected, irregular appearing nails, foot or toe lump or mass"
myocarditis,"sharp chest pain, dizziness, palpitations"
preeclampsia,"sharp abdominal pain, headache, lower abdominal pain, pain during pregnancy, vaginal redness, spots or clouds in vision, problems during pregnancy, recent pregnancy, uterine contractions"
ischemic heart disease,"shortness of breath, sharp chest pain, dizziness, chest tightness, palpitations, throat feels tight, peripheral edema, muscle pain, difficulty breathing, fatigue, lymphedema"
neurofibromatosis,"abnormal involuntary movements, groin mass, headache, abnormal appearing skin"
chickenpox,"cough, pain in testicles, abnormal appearing skin, fever, itching of skin, skin rash"
pancreatic cancer,"jaundice, sharp abdominal pain, nausea, diarrhea, arm swelling, ache all over, stomach bloating"
neuropathy due to drugs,"cough, vomiting, foot or toe pain, problems with movement, loss of sensation"
croup,"shortness of breath, hoarse voice, sore throat, cough, nasal congestion, vomiting, wheezing, fever, coryza, abnormal breathing sounds, pulling at ears"
idiopathic excessive menstruation,"sharp abdominal pain, involuntary urination, vaginal discharge, intermenstrual bleeding, cramps and spasms, blood clots during menstrual periods, long menstrual periods, heavy menstrual flow, unpredictable menstruation, painful menstruation, frequent menstruation"
amblyopia,"pus draining from ear, eye deviation, diminished vision, cross-eyed, pain in eye"
meckel diverticulum,"lower abdominal pain, knee lump or mass"
dislocation of the wrist,"depression, elbow weakness, hand or finger pain, arm pain"
ear drum damage,"cough, nasal congestion, diminished hearing, pus draining from ear, ear pain, ringing in ear, plugged feeling in ear, fluid in ear, pulling at ears, redness in ear, bleeding from ear"
erectile dysfunction,"retention of urine, pain in testicles, involuntary urination, pain during intercourse, frequent urination, blood in urine, impotence, symptoms of prostate, excessive urination at night, loss of sex drive"
temporary or benign blood in urine,"retention of urine, suprapubic pain, sharp abdominal pain, painful urination, involuntary urination, frequent urination, lower abdominal pain, blood in urine, back pain, regurgitation, regurgitation.1, symptoms of bladder"
kidney disease due to longstanding hypertension,"shortness of breath, difficulty speaking, feeling cold, symptoms of the kidneys"
chondromalacia of the patella,"leg pain, knee pain, bones are painful, knee weakness, knee swelling, problems with movement"
onychomycosis,"skin swelling, abnormal appearing skin, skin growth, foot or toe pain, skin on leg or foot looks infected, irregular appearing nails, skin dryness, peeling, scaliness, or roughness, too little hair, skin rash"
urethral disorder,"retention of urine, suprapubic pain, abusing alcohol, sharp abdominal pain, vomiting, painful urination, involuntary urination, side pain"
lyme disease,"depressive or psychotic symptoms, hip pain, headache, abnormal appearing skin, symptoms of the face, fever, fatigue"
iron deficiency anemia,"dizziness, blood in stool, intermenstrual bleeding, regurgitation, weight gain, heartburn, weakness, fatigue, regurgitation.1, rectal bleeding, heavy menstrual flow"
acute respiratory distress syndrome (ards),"shortness of breath, depressive or psychotic symptoms, sharp chest pain, chest tightness, cough, wheezing, fever, difficulty breathing, chills"
toxic multinodular goiter,"abnormal involuntary movements, irregular heartbeat, involuntary urination, double vision, fatigue"
open wound of the finger,"hand or finger pain, hand or finger swelling, hand or finger stiffness or tightness, skin on arm or hand looks infected"
autonomic nervous system disorder,"dizziness, difficulty in swallowing, leg pain, headache, decreased appetite"
psychosexual disorder,"depression, involuntary urination, pain during intercourse, impotence, fatigue, loss of sex drive, premature ejaculation"
anemia,"shortness of breath, dizziness, vomiting blood, weakness, changes in stool appearance, fatigue, melena, nosebleed"
tendinitis,"leg pain, hip pain, hand or finger pain, wrist pain, hand or finger swelling, arm pain, knee pain, foot or toe pain, ankle pain, shoulder pain"
common cold,"sore throat, cough, nasal congestion, vomiting, headache, wheezing, ear pain, fever, chills, coryza, flu-like syndrome"
amyotrophic lateral sclerosis (als),"abnormal involuntary movements, difficulty speaking, difficulty in swallowing, weakness, leg cramps or spasms"
central retinal artery or vein occlusion,"irregular heartbeat, diminished vision, symptoms of eye, pain in eye, foreign body sensation in eye, blindness"
paroxysmal supraventricular tachycardia,"shortness of breath, sharp chest pain, dizziness, chest tightness, palpitations, irregular heartbeat, involuntary urination, weakness, increased heart rate"
venous insufficiency,"leg pain, abnormal appearing skin, skin lesion, leg cramps or spasms, lymphedema, skin on leg or foot looks infected, fluid retention, burning chest pain"
trichomonas infection,"sharp abdominal pain, vomiting, nausea, vaginal itching, lower abdominal pain, vaginal discharge, pain during pregnancy, unpredictable menstruation"
acne,"skin swelling, abnormal appearing skin, acne or pimples, skin growth, irregular appearing scalp, skin moles, long menstrual periods, skin dryness, peeling, scaliness, or roughness, skin rash"
depression,"anxiety and nervousness, depression, depressive or psychotic symptoms, insomnia, abusing alcohol, hostile behavior, drug abuse, excessive anger, disturbance of memory, delusions or hallucinations, temper problems"
drug abuse,"anxiety and nervousness, depression, depressive or psychotic symptoms, abusing alcohol, hostile behavior, drug abuse, smoking problems, delusions or hallucinations, sweating, antisocial behavior"
urinary tract obstruction,"retention of urine, suprapubic pain, sharp abdominal pain, painful urination, frequent urination, blood in urine, back pain, side pain, symptoms of prostate, excessive urination at night"
diabetes insipidus,"dizziness, emotional symptoms"
iridocyclitis,"headache, diminished vision, symptoms of eye, pain in eye, foreign body sensation in eye, eye redness, lacrimation, eye burns or stings, cloudy eye"
varicocele of the testicles,"symptoms of the scrotum and testes, swelling of scrotum, pain in testicles, mass in scrotum, involuntary urination, lower abdominal pain, skin growth, pain of the anus, groin pain, infertility"
irritable bowel syndrome,"anxiety and nervousness, insomnia, flatulence, sharp abdominal pain, nausea, diarrhea, lower abdominal pain, burning abdominal pain, upper abdominal pain"
fracture of the foot,"foot or toe pain, ankle pain, foot or toe swelling, ankle swelling, foot or toe stiffness or tightness, foot or toe weakness"
ovarian cyst,"sharp abdominal pain, vomiting, nausea, lower abdominal pain, vaginal discharge, intermenstrual bleeding, pelvic pain, burning abdominal pain, painful menstruation"
chlamydia,"sharp abdominal pain, vaginal itching, lower abdominal pain, vaginal discharge, pelvic pain, vaginal pain"
parasitic disease,"cough, retention of urine, sharp abdominal pain, hand or finger swelling, abnormal appearing skin, skin rash"
fracture of the jaw,"facial pain, pain in eye, peripheral edema, jaw swelling, bones are painful, mouth pain"
lipoma,"skin swelling, groin mass, abnormal appearing skin, skin lesion, skin growth, neck mass, bones are painful, back mass or lump, shoulder lump or mass, arm lump or mass"
female genitalia infection,"skin swelling, vaginal discharge, skin lesion, vaginal pain, vulvar irritation, groin pain, vulvar sore"
pulmonary hypertension,"shortness of breath, sharp chest pain, palpitations, cough, feeling ill, difficulty breathing, fatigue, hemoptysis, apnea"
thyroid nodule,"hoarse voice, diminished hearing, throat feels tight, difficulty in swallowing, back weakness, neck mass, fatigue"
broken tooth,"lip swelling, toothache, dry lips, facial pain, difficulty eating, gum pain, bleeding gums"
dumping syndrome,"vomiting, nausea, knee lump or mass"
lymphadenitis,"sore throat, cough, skin swelling, sharp abdominal pain, neck pain, neck mass, ear pain, neck swelling, fever"
injury to the face,"diminished hearing, headache, facial pain, neck pain, ear pain, neck stiffness or tightness, nosebleed, bleeding from ear, mouth pain"
aortic valve disease,"shortness of breath, sharp chest pain, palpitations, irregular heartbeat, groin mass, fainting, peripheral edema, difficulty breathing, lymphedema"
rheumatoid arthritis,"hand or finger pain, wrist pain, hand or finger swelling, wrist swelling, peripheral edema, knee pain, ache all over, joint pain, elbow swelling, joint swelling"
spermatocele,"retention of urine, elbow weakness, pain in testicles, mass in scrotum, frequent urination"
impetigo,"cough, nasal congestion, skin swelling, abnormal appearing skin, skin lesion, mouth ulcer, fever, itching of skin, skin rash, sore in nose"
anal fistula,"blood in stool, mass in scrotum, pain of the anus, rectal bleeding"
hypothermia,"depressive or psychotic symptoms, emotional symptoms, fainting, weakness"
oppositional disorder,"depressive or psychotic symptoms, fainting, hostile behavior, restlessness, excessive anger, temper problems, low self-esteem, obsessions and compulsions, antisocial behavior, low urine output"
migraine,"dizziness, vomiting, headache, nausea, diminished vision, spots or clouds in vision, blindness, symptoms of the face, disturbance of memory"
diabetic peripheral neuropathy,"leg pain, skin lesion, foot or toe pain, problems with movement, foot or toe swelling, loss of sensation, paresthesia, lymphedema, foot or toe stiffness or tightness"
testicular disorder,"hoarse voice, symptoms of the scrotum and testes, impotence, fatigue, loss of sex drive"
gestational diabetes,"pain during pregnancy, vaginal redness, problems during pregnancy, uterine contractions, pelvic pressure"
hidradenitis suppurativa,"skin swelling, groin mass, arm pain, skin lesion, skin growth, skin rash"
valley fever,"shortness of breath, hand or finger pain, fever, shoulder swelling"
conjunctivitis due to bacteria,"sore throat, cough, nasal congestion, abnormal appearing skin, eye redness, fever"
lewy body dementia,"depressive or psychotic symptoms, abnormal involuntary movements, hostile behavior, disturbance of memory, delusions or hallucinations"
multiple myeloma,"lip swelling, problems with movement, weakness, disturbance of memory, fatigue"
head injury,"dizziness, fainting, headache, lip swelling, facial pain, double vision, back pain, neck pain"
ascending cholangitis,"shortness of breath, retention of urine, jaundice, sharp abdominal pain, fever"
idiopathic irregular menstrual cycle,"sharp abdominal pain, lower abdominal pain, intermenstrual bleeding, pelvic pain, cramps and spasms, long menstrual periods, heavy menstrual flow, unpredictable menstruation, painful menstruation, infertility, frequent menstruation"
interstitial lung disease,"shortness of breath, sore throat, cough, nasal congestion, headache, wheezing, fever, sleepiness, abnormal breathing sounds"
mononeuritis,"leg pain, hand or finger pain, wrist pain, arm pain, foot or toe pain, ankle pain, elbow pain, loss of sensation, shoulder pain, hand or finger weakness"
malaria,"fainting, headache, knee lump or mass, fever"
somatization disorder,"anxiety and nervousness, depression, dizziness, fainting, ache all over"
hypovolemia,"dizziness, fainting, sharp abdominal pain, feeling ill, vomiting, nausea, diarrhea, decreased appetite, fever"
schizophrenia,"anxiety and nervousness, depression, depressive or psychotic symptoms, insomnia, hostile behavior, excessive anger, delusions or hallucinations, temper problems, fears and phobias, low self-esteem, hysterical behavior"
knee ligament or meniscus tear,"knee pain, knee weakness, knee swelling, knee lump or mass, knee stiffness or tightness, leg stiffness or tightness, leg weakness"
endocarditis,"shortness of breath, sharp chest pain, dizziness, palpitations, irregular heartbeat, increased heart rate"
sepsis,"shortness of breath, cough, suprapubic pain, sharp abdominal pain, feeling ill, vomiting, weakness, decreased appetite, fever, difficulty breathing, chills"
heat stroke,"dizziness, feeling hot"
cholecystitis,"sharp chest pain, sharp abdominal pain, vomiting, nausea, back pain, burning abdominal pain, side pain, lower body pain, upper abdominal pain, stomach bloating, regurgitation.1, symptoms of the kidneys"
cardiac arrest,"shortness of breath, sharp chest pain, palpitations, irregular heartbeat, arm swelling, weakness, decreased heart rate, difficulty breathing"
cardiomyopathy,"shortness of breath, sharp chest pain, chest tightness, irregular heartbeat, peripheral edema, heartburn, decreased heart rate, fatigue"
social phobia,"anxiety and nervousness, depression, depressive or psychotic symptoms, insomnia, abusing alcohol, excessive appetite, excessive anger, delusions or hallucinations, fears and phobias"
meningitis,"cough, vomiting, headache, nausea, neck pain, neck stiffness or tightness, fever, ache all over"
spherocytosis,"cough, elbow weakness, skin rash"
hormone disorder,"lack of growth, headache, hot flashes, acne or pimples, excessive growth"
raynaud disease,"hand or finger pain, hand or finger swelling, loss of sensation"
reactive arthritis,"hip pain, knee lump or mass"
