disease,symptoms
chronic otitis media,"cough, nasal congestion, ear pain, plugged feeling in ear, fluid in ear, fever, allergic reaction, pulling at ears, redness in ear, painful sinuses"
fracture of the finger,"hand or finger pain, hand or finger swelling, hand or finger stiffness or tightness, foot or toe pain, foot or toe swelling"
hirschsprung disease,"emotional symptoms, sharp abdominal pain, constipation"
polymyalgia rheumatica,"sharp chest pain, irregular heartbeat, difficulty in swallowing, leg pain, shoulder pain, fatigue"
lymphedema,"throat swelling, leg pain, abnormal appearing skin, skin lesion, peripheral edema, leg swelling, foot or toe swelling, lymphedema, fluid retention"
bladder cancer,"retention of urine, groin mass, mass in scrotum, blood in urine, excessive urination at night, symptoms of bladder, bladder mass"
acute bronchospasm,"shortness of breath, sharp chest pain, chest tightness, sore throat, cough, nasal congestion, vomiting, wheezing, fever, difficulty breathing, coryza"
acute glaucoma,"diminished vision, double vision, symptoms of eye, pain in eye, foreign body sensation in eye, spots or clouds in vision, eye redness, blindness"
open wound of the chest,"sharp chest pain, drug abuse"
dislocation of the patella,"knee pain, knee swelling, knee stiffness or tightness"
sciatica,"leg pain, hip pain, low back pain, problems with movement, loss of sensation, leg cramps or spasms, lower body pain, unusual color or odor to urine, back cramps or spasms, leg weakness"
hypercalcemia,"dizziness, retention of urine, weakness, loss of sensation"
stress incontinence,"retention of urine, painful urination, involuntary urination, frequent urination, blood in urine, hot flashes, intermenstrual bleeding"
varicose veins,"leg pain, skin lesion, peripheral edema, leg swelling, leg cramps or spasms, ache all over, lymphedema, leg lump or mass"
benign kidney cyst,"sharp abdominal pain, vomiting, involuntary urination, blood in urine, low back pain, impotence, side pain"
hydrocele of the testicle,"retention of urine, groin mass, symptoms of the scrotum and testes, swelling of scrotum, pain in testicles, mass in scrotum, lower abdominal pain, groin pain"
degenerative disc disease,"leg pain, hip pain, arm pain, back pain, neck pain, low back pain, loss of sensation, paresthesia, shoulder pain, lower body pain, joint pain"
hirsutism,"abnormal appearing skin, acne or pimples, apnea, unwanted hair"
dislocation of the foot,"elbow weakness, vomiting, foot or toe pain"
hydronephrosis,"suprapubic pain, pain in testicles, sharp abdominal pain, vomiting, nausea, lower abdominal pain, back pain, side pain"
diverticulosis,"blood in stool, sharp abdominal pain, vomiting, nausea, diarrhea, lower abdominal pain, heartburn, upper abdominal pain, melena, rectal bleeding"
pain after an operation,"sharp chest pain, leg pain, sharp abdominal pain, vomiting, headache, nausea, lower abdominal pain, back pain, neck pain, low back pain, side pain"
huntington disease,"anxiety and nervousness, elbow weakness"
lymphoma,"hoarse voice, groin mass, regurgitation, neck mass, itchy ear(s), fatigue, regurgitation.1"
dermatitis due to sun exposure,"skin swelling, lack of growth, abnormal appearing skin, skin lesion, acne or pimples, irregular appearing scalp, skin moles, skin dryness, peeling, scaliness, or roughness, skin rash"
anemia due to chronic kidney disease,"shortness of breath, peripheral edema, recent weight loss, weakness, fatigue, ankle swelling"
injury to internal organ,"sharp chest pain, retention of urine, sharp abdominal pain, frequent urination, back pain, side pain"
scleritis,"abnormal involuntary movements, headache, pain in eye, spots or clouds in vision, eye redness"
pterygium,"acne or pimples, diminished vision, symptoms of eye, foreign body sensation in eye, spots or clouds in vision, eye redness, lacrimation"
fungal infection of the skin,"skin swelling, abnormal appearing skin, skin lesion, acne or pimples, irregular appearing scalp, itching of skin, skin dryness, peeling, scaliness, or roughness, itchy scalp, too little hair, skin rash"
insulin overdose,"depressive or psychotic symptoms, emotional symptoms"
syndrome of inappropriate secretion of adh (siadh),"dizziness, feeling ill, cross-eyed"
foreign body in the ear,"diminished hearing, throat feels tight, ear pain, fluid in ear, bleeding from ear"
premenstrual tension syndrome,"depressive or psychotic symptoms, headache, lower abdominal pain, back pain, unpredictable menstruation, premenstrual tension or irritability"
orbital cellulitis,"diminished hearing, symptoms of eye, pain in eye, peripheral edema, eye redness, fever, swollen eye"
injury to the leg,"leg pain, knee pain, foot or toe pain, ankle pain, knee swelling, problems with movement, knee stiffness or tightness, leg swelling, foot or toe swelling, infant feeding problem, irregular appearing nails, ankle swelling"
hepatic encephalopathy,"shortness of breath, depressive or psychotic symptoms, abusing alcohol, fainting, sharp abdominal pain, fluid retention"
bone cancer,"leg pain, low back pain, peripheral edema, problems with movement, fatigue"
syringomyelia,"fainting, headache, back pain, shoulder pain"
pulmonary fibrosis,"shortness of breath, sharp chest pain, chest tightness, cough, fainting, fever, difficulty breathing"
mitral valve disease,"shortness of breath, sharp chest pain, dizziness, chest tightness, irregular heartbeat, increased heart rate, fatigue, sweating, nightmares"
parkinson disease,"dizziness, abnormal involuntary movements, difficulty speaking, problems with movement, weakness, focal weakness, disturbance of memory, leg stiffness or tightness, stiffness all over"
gout,"hand or finger pain, wrist pain, hand or finger swelling, wrist swelling, knee pain, foot or toe pain, ankle pain, knee swelling, leg swelling, foot or toe swelling, joint pain, ankle swelling"
otitis media,"sore throat, cough, nasal congestion, diminished hearing, vomiting, ear pain, plugged feeling in ear, fluid in ear, fever, coryza, pulling at ears"
drug abuse (opioids),"anxiety and nervousness, depression, depressive or psychotic symptoms, insomnia, abusing alcohol, drug abuse, restlessness, excessive anger, delusions or hallucinations, temper problems"
myelodysplastic syndrome,"difficulty speaking, chills, fatigue"
fracture of the shoulder,"arm pain, arm stiffness or tightness, neck swelling, bones are painful, shoulder pain, shoulder stiffness or tightness, shoulder swelling"
acute kidney injury,"shortness of breath, sharp chest pain, dizziness, retention of urine, sharp abdominal pain, vomiting, nausea, peripheral edema, weakness, kidney mass, symptoms of the kidneys"
threatened pregnancy,"sharp abdominal pain, lower abdominal pain, vaginal discharge, intermenstrual bleeding, back pain, pelvic pain, problems during pregnancy, spotting or bleeding during pregnancy, cramps and spasms, blood clots during menstrual periods, uterine contractions"
intracranial abscess,"depressive or psychotic symptoms, headache, seizures"
gum disease,"lip swelling, toothache, facial pain, mouth ulcer, peripheral edema, ear pain, jaw swelling, fever, gum pain, bleeding gums, pain in gums"
open wound from surgical incision,"skin swelling, flatulence, skin lesion"
gastrointestinal hemorrhage,"dizziness, blood in stool, fainting, sharp abdominal pain, vomiting, nausea, diarrhea, vomiting blood, weakness, changes in stool appearance, melena, rectal bleeding"
seborrheic dermatitis,"abnormal appearing skin, skin lesion, acne or pimples, skin growth, irregular appearing scalp, symptoms of the face, itching of skin, skin dryness, peeling, scaliness, or roughness, too little hair, skin rash, dry or flaky scalp"
drug abuse (methamphetamine),"anxiety and nervousness, shortness of breath, depressive or psychotic symptoms, palpitations, abusing alcohol, hostile behavior, drug abuse, feeling ill"
torticollis,"abnormal involuntary movements, throat swelling, headache, arm pain, neck pain, neck stiffness or tightness, shoulder pain, neck cramps or spasms"
poisoning due to antihypertensives,"depressive or psychotic symptoms, sharp abdominal pain, weakness"
tension headache,"anxiety and nervousness, dizziness, headache, nausea, neck pain, neck stiffness or tightness, chills, back cramps or spasms"
alcohol intoxication,"anxiety and nervousness, depression, depressive or psychotic symptoms, sharp chest pain, abnormal involuntary movements, abusing alcohol, vomiting, problems with movement"
scurvy,"sharp abdominal pain, knee lump or mass"
narcolepsy,"shortness of breath, insomnia, headache, disturbance of memory, fatigue, sleepiness, apnea"
food allergy,"cough, nasal congestion, vomiting, hand or finger swelling, lip swelling, abnormal appearing skin, allergic reaction, itching of skin, skin rash"
labyrinthitis,"dizziness, diminished hearing, vomiting, headache, nausea, ear pain, plugged feeling in ear, spots or clouds in vision, loss of sensation, sweating"
anxiety,"anxiety and nervousness, depression, shortness of breath, depressive or psychotic symptoms, sharp chest pain, insomnia, abnormal involuntary movements, palpitations, irregular heartbeat, headache, increased heart rate, fears and phobias"
impulse control disorder,"anxiety and nervousness, depression, depressive or psychotic symptoms, insomnia, excessive appetite, excessive anger, delusions or hallucinations, temper problems"
stenosis of the tear duct,"cough, white discharge from eye, symptoms of eye, abnormal movement of eyelid, lacrimation"
abscess of nose,"sore throat, cough, nasal congestion, irritable infant, vomiting, fever, coryza, sinus congestion"
omphalitis,"emotional symptoms, flatulence, irregular belly button"
leukemia,"fever, muscle stiffness or tightness, fatigue, mouth pain"
bell palsy,"abnormal involuntary movements, headache, facial pain, diminished vision, symptoms of eye, peripheral edema, weakness, loss of sensation, focal weakness, symptoms of the face"
conjunctivitis due to allergy,"cough, nasal congestion, diminished vision, symptoms of eye, pain in eye, eye redness, lacrimation, itchiness of eye, eye burns or stings, allergic reaction, swollen eye, sneezing"
drug reaction,"shortness of breath, dizziness, throat swelling, vomiting, headache, nausea, abnormal appearing skin, peripheral edema, allergic reaction, itching of skin, skin rash"
adrenal cancer,"dizziness, diminished hearing"
myopia,"eye deviation, diminished vision, symptoms of eye, pain in eye, eye moves abnormally, foreign body sensation in eye, spots or clouds in vision, eye redness, blindness"
osteoarthritis,"leg pain, hip pain, hand or finger pain, back pain, knee pain, ankle pain, knee weakness, elbow pain, knee swelling, muscle pain, joint pain"
thyroid disease,"lump in throat, throat feels tight, difficulty in swallowing, neck mass"
pharyngitis,"hoarse voice, sore throat, cough, wheezing, fever"
chronic rheumatic fever,"shortness of breath, sharp chest pain, dizziness, chest tightness, palpitations, throat feels tight, increased heart rate"
hypocalcemia,"shortness of breath, sharp chest pain, abnormal involuntary movements, constipation, leg weakness"
macular degeneration,"diminished vision, double vision, symptoms of eye, pain in eye, abnormal movement of eyelid, foreign body sensation in eye, spots or clouds in vision, lacrimation, itchiness of eye, blindness, bleeding from eye"
pneumonia,"shortness of breath, sharp chest pain, sore throat, cough, nasal congestion, vomiting, wheezing, weakness, fever, difficulty breathing, chills, coryza"
cold sore,"sore throat, skin swelling, vaginal itching, lip swelling, mouth ulcer, skin rash, lip sore"
premature ventricular contractions (pvcs),"shortness of breath, sharp chest pain, chest tightness, palpitations, irregular heartbeat, fainting, impotence, sleepiness"
testicular cancer,"anxiety and nervousness, diminished hearing, mass in scrotum"
hydrocephalus,"depressive or psychotic symptoms, abnormal involuntary movements, lack of growth, vomiting, headache, problems with movement, seizures"
breast cancer,"hot flashes, bleeding or discharge from nipple, pain or soreness of breast, lump or mass of breast"
anemia due to malignancy,"shortness of breath, difficulty in swallowing, flatulence, fatigue"
esophageal varices,"dizziness, nausea"
endometrial cancer,"vaginal itching, hot flashes, intermenstrual bleeding, absence of menstruation, vaginal bleeding after menopause"
cystic fibrosis,"cough, feeling ill, intermenstrual bleeding, decreased appetite"
intertrigo (skin condition),"skin swelling, abnormal appearing skin, skin lesion, acne or pimples, skin dryness, peeling, scaliness, or roughness, skin rash"
parathyroid adenoma,"anxiety and nervousness, throat feels tight, disturbance of memory, shoulder pain"
glucocorticoid deficiency,"shortness of breath, lack of growth, diarrhea"
temporomandibular joint disorder,"sore throat, nasal congestion, diminished hearing, headache, facial pain, pain in eye, neck pain, ear pain"
wilson disease,"insomnia, cough, sleepiness"
vesicoureteral reflux,"suprapubic pain, involuntary urination, blood in urine, fever"
vitamin a deficiency,"hand or finger pain, knee lump or mass"
gonorrhea,"sharp abdominal pain, vaginal itching, vaginal discharge, problems with movement, vaginal pain, penile discharge"
fracture of the rib,"shortness of breath, sharp chest pain, hip pain, back pain, bones are painful, side pain, shoulder pain, ache all over, rib pain, back mass or lump, hurts to breath"
ependymoma,"emotional symptoms, headache, diminished vision, pain in eye"
hepatitis due to a toxin,"depression, jaundice, sharp abdominal pain, feeling ill, vomiting, nausea, rectal bleeding, itching of skin"
vaginal cyst,"sharp abdominal pain, lower abdominal pain, vaginal discharge, intermenstrual bleeding, pain during pregnancy, pelvic pain, vaginal pain, problems during pregnancy, spotting or bleeding during pregnancy, cramps and spasms, blood clots during menstrual periods, heavy menstrual flow"
open wound of the shoulder,"abusing alcohol, arm pain, shoulder pain"
ectopic pregnancy,"dizziness, sharp abdominal pain, nausea, lower abdominal pain, vaginal discharge, intermenstrual bleeding, pain during pregnancy, pelvic pain"
chronic knee pain,"leg pain, hip pain, back pain, knee pain, knee weakness, knee swelling, knee stiffness or tightness, leg swelling, joint pain"
pinguecula,"headache, symptoms of eye, lacrimation, itching of scrotum"
hypergammaglobulinemia,"blood in stool, fatigue"
alcohol abuse,"anxiety and nervousness, depression, depressive or psychotic symptoms, abusing alcohol, hostile behavior, drug abuse, vomiting blood, smoking problems, low self-esteem"
carpal tunnel syndrome,"hand or finger pain, wrist pain, hand or finger swelling, arm pain, wrist swelling, hand or finger stiffness or tightness, neck pain, elbow pain, loss of sensation, paresthesia, arm weakness"
pituitary disorder,"lack of growth, headache, hot flashes, pain in eye"
kidney stone,"retention of urine, suprapubic pain, sharp abdominal pain, vomiting, painful urination, frequent urination, lower abdominal pain, blood in urine, back pain, low back pain, side pain"
autism,"depressive or psychotic symptoms, difficulty speaking, lack of growth, hostile behavior, seizures, constipation, temper problems, long menstrual periods, antisocial behavior"
cat scratch disease,"skin swelling, groin mass, itchy eyelid"
chronic glaucoma,"white discharge from eye, diminished vision, symptoms of eye, pain in eye, foreign body sensation in eye, spots or clouds in vision, lacrimation, itchiness of eye, eye burns or stings, mass on eyelid"
retinal detachment,"diminished vision, double vision, symptoms of eye, pain in eye, spots or clouds in vision, lacrimation, itchiness of eye, blindness"
aplastic anemia,"lack of growth, nausea, weakness, slurring words, fever, fatigue"
overflow incontinence,"retention of urine, suprapubic pain, involuntary urination, blood in urine, hand or finger stiffness or tightness, impotence, symptoms of bladder"
hemolytic anemia,"cough, nausea, skin growth, fatigue"
lateral epicondylitis (tennis elbow),"hand or finger pain, wrist pain, arm pain, hand or finger stiffness or tightness, elbow pain, loss of sensation, shoulder pain, joint pain"
open wound of the eye,"white discharge from eye, diminished vision, symptoms of eye, pain in eye, spots or clouds in vision"
syphilis,"headache, vaginal discharge, muscle pain, skin rash"
diabetic kidney disease,"blood in stool, impotence"
nose disorder,"sore throat, cough, nasal congestion, headache, facial pain, ear pain, fever, difficulty breathing, coryza, sinus congestion, painful sinuses, nosebleed"
drug withdrawal,"anxiety and nervousness, depression, dizziness, sharp abdominal pain, vomiting, nausea, chills"
dental caries,"skin swelling, toothache, facial pain, restlessness, peripheral edema, ear pain, jaw swelling, neck swelling, gum pain, skin irritation, mouth pain, pain in gums"
hypercholesterolemia,"sharp chest pain, palpitations, hand or finger stiffness or tightness, weight gain, excessive urination at night"
fracture of the patella,"leg pain, hip pain, knee pain, bones are painful, knee swelling, leg weakness"
kidney failure,"shortness of breath, sharp chest pain, vomiting, nausea, arm swelling, leg swelling, swollen abdomen, symptoms of the kidneys"
fracture of the neck,"leg pain, hip pain, low back pain, elbow pain, lower body pain"
muscle spasm,"sharp chest pain, abnormal involuntary movements, leg pain, headache, arm pain, back pain, neck pain, low back pain, loss of sensation, muscle cramps, contractures, or spasms"
hemophilia,"cough, leg pain, frontal headache, bleeding gums"
hyperosmotic hyperketotic state,"cough, frequent urination, weakness"
peritonsillar abscess,"sore throat, throat swelling, throat feels tight, difficulty in swallowing, headache, swollen lymph nodes, ear pain"
gastroparesis,"sharp chest pain, sharp abdominal pain, vomiting, nausea, regurgitation, burning abdominal pain, upper abdominal pain, regurgitation.1"
itching of unknown cause,"vaginal itching, abnormal appearing skin, problems during pregnancy, allergic reaction, fluid retention, itching of skin, skin dryness, peeling, scaliness, or roughness, itchy scalp, skin rash"
polycythemia vera,"dizziness, headache, symptoms of eye, weight gain, fatigue"
thrombocytopenia,"sharp chest pain, blood in stool, blood in urine, irregular appearing scalp, fatigue, nosebleed, bleeding gums"
head and neck cancer,"hoarse voice, sore throat, throat feels tight, difficulty in swallowing, neck mass, plugged feeling in ear, hemoptysis, mouth pain"
pseudohypoparathyroidism,"leg pain, elbow weakness, wrist pain, knee pain"
goiter,"lump in throat, difficulty in swallowing, hot flashes, weight gain, fatigue"
urge incontinence,"retention of urine, vaginal itching, painful urination, involuntary urination, frequent urination, blood in urine, excessive urination at night, constipation, symptoms of bladder"
edward syndrome,"suprapubic pain, cross-eyed"
open wound of the arm,"arm pain, knee weakness, elbow pain, redness in or around nose"
muscular dystrophy,"cough, nasal congestion, hip pain, feeling cold, fatigue"
mittelschmerz,"sharp abdominal pain, vomiting, diarrhea, lower abdominal pain, pelvic pain, painful menstruation"
corneal abrasion,"white discharge from eye, diminished vision, symptoms of eye, pain in eye, foreign body sensation in eye, eye redness, lacrimation, itchiness of eye, eyelid swelling"
anemia of chronic disease,"dizziness, emotional symptoms, feeling ill, weakness"
dysthymic disorder,"anxiety and nervousness, depression, depressive or psychotic symptoms, insomnia, excessive anger, slurring words, disturbance of memory, temper problems, loss of sex drive"
scarlet fever,"sore throat, cough, throat swelling, skin swelling, fever, skin rash"
hypertensive heart disease,"shortness of breath, sharp chest pain, insomnia, chest tightness, palpitations, leg swelling, heartburn, weakness, difficulty breathing, fatigue, recent pregnancy"
drug abuse (barbiturates),"anxiety and nervousness, depression, abnormal involuntary movements, hostile behavior, drug abuse, delusions or hallucinations"
polycystic ovarian syndrome (pcos),"hot flashes, intermenstrual bleeding, pelvic pain, weight gain, absence of menstruation, long menstrual periods, unpredictable menstruation, infertility"
encephalitis,"dizziness, insomnia, headache, loss of sensation, disturbance of memory"
cyst of the eyelid,"skin growth, diminished vision, abnormal movement of eyelid, muscle swelling, mass on eyelid"
balanitis,"cough, suprapubic pain, painful urination, abnormal appearing skin, itching of skin, skin rash, penis pain, penis redness, diaper rash"
foreign body in the throat,"shortness of breath, sore throat, cough, throat swelling, difficulty in swallowing, vomiting, infant spitting up"
drug abuse (cocaine),"depression, depressive or psychotic symptoms, sharp chest pain, abusing alcohol, hostile behavior, drug abuse, excessive anger, delusions or hallucinations, fears and phobias"
optic neuritis,"retention of urine, headache, diminished vision, blindness"
alcohol withdrawal,"depressive or psychotic symptoms, sharp chest pain, dizziness, abnormal involuntary movements, abusing alcohol, fainting, vomiting, seizures, delusions or hallucinations, antisocial behavior"
premature atrial contractions (pacs),"shortness of breath, dizziness, palpitations, irregular heartbeat, fainting, fatigue, muscle swelling"
hemiplegia,"abnormal involuntary movements, difficulty speaking, headache, arm stiffness or tightness, problems with movement, weakness, loss of sensation, slurring words, seizures"
hammer toe,"skin lesion, skin growth, foot or toe pain, loss of sensation"
open wound of the cheek,"wrist pain, facial pain"
joint effusion,"wrist pain, wrist swelling, knee pain, ankle pain, elbow pain, knee swelling, problems with movement, knee stiffness or tightness, ankle swelling"
open wound of the knee,"leg pain, leg swelling"
meningioma,"depressive or psychotic symptoms, dizziness, headache, weakness, disturbance of memory"
brain cancer,"difficulty speaking, headache, weakness, decreased appetite, focal weakness, slurring words, disturbance of memory, seizures"
placental abruption,"emotional symptoms, nausea, spotting or bleeding during pregnancy, uterine contractions"
seasonal allergies (hay fever),"sore throat, cough, nasal congestion, headache, ear pain, frontal headache, lacrimation, itchiness of eye, coryza, allergic reaction, sneezing"
lung cancer,"shortness of breath, cough, smoking problems, decreased appetite, fatigue, hemoptysis, leg weakness"
primary kidney disease,"lack of growth, blood in urine, impotence, peripheral edema, symptoms of the kidneys"
uterine cancer,"groin mass, pelvic pain, vaginal bleeding after menopause"
dry eye of unknown cause,"white discharge from eye, diminished vision, double vision, symptoms of eye, pain in eye, abnormal movement of eyelid, foreign body sensation in eye, spots or clouds in vision, eye redness, lacrimation, itchiness of eye"
fibrocystic breast disease,"intermenstrual bleeding, bleeding or discharge from nipple, pain or soreness of breast, lump or mass of breast"
fungal infection of the hair,"skin swelling, abnormal appearing skin, skin lesion, acne or pimples, skin growth, irregular appearing scalp, pelvic pain, itching of skin, skin dryness, peeling, scaliness, or roughness, skin irritation, itchy scalp, skin rash"
tooth abscess,"skin swelling, lip swelling, toothache, facial pain, peripheral edema, jaw swelling, neck swelling, gum pain, mouth pain, pain in gums"
envenomation from spider or animal bite,"skin swelling, hand or finger swelling, arm swelling, abnormal appearing skin, foot or toe swelling, paresthesia, allergic reaction, fluid retention, itching of skin"
vacterl syndrome,"suprapubic pain, emotional symptoms"
vertebrobasilar insufficiency,"sharp chest pain, dizziness, leg pain, back pain"
rectal disorder,"blood in stool, sharp abdominal pain, diarrhea, pain of the anus, burning abdominal pain, heartburn, cramps and spasms, melena, rectal bleeding, constipation, itching of the anus"
atonic bladder,"retention of urine, suprapubic pain, emotional symptoms, impotence, symptoms of bladder"
benign paroxysmal positional vertical (bppv),"dizziness, irregular heartbeat, fainting, vomiting, headache, nausea, problems with movement, weakness, frontal headache"
blepharospasm,"headache, diminished vision, abnormal movement of eyelid, low back weakness"
sarcoidosis,"shortness of breath, sharp chest pain, chest tightness, cough, headache, facial pain, pain in eye, peripheral edema"
metastatic cancer,"vaginal dryness, neck mass, decreased appetite, focal weakness, fatigue"
trigger finger (finger disorder),"hand or finger pain, wrist pain, hand or finger swelling, hand or finger stiffness or tightness, bones are painful, hand or finger cramps or spasms"
stye,"skin swelling, abnormal appearing skin, symptoms of eye, pain in eye, eye redness, itchiness of eye, eye burns or stings, mass on eyelid, swollen eye, eyelid swelling, eyelid lesion or rash"
hemochromatosis,"difficulty speaking, abnormal appearing skin, ache all over"
osteochondroma,"lower abdominal pain, lip swelling, abnormal appearing skin, skin lesion, skin growth, knee pain, foot or toe pain"
cushing syndrome,"emotional symptoms, weight gain"
typhoid fever,"wrist pain, fever"
vitreous degeneration,"diminished vision, double vision, symptoms of eye, pain in eye, foreign body sensation in eye, spots or clouds in vision, eye redness, lacrimation"
atrophic skin condition,"skin swelling, lip swelling, abnormal appearing skin, skin lesion, acne or pimples, skin growth, skin moles, skin irritation, wrinkles on skin"
aspergillosis,"shortness of breath, knee lump or mass"
